{
  "schema_version": "1.0",
  "proposal": {
    "proposal_id": "portfolio-20261014-fivem-server-monitor-pro-quota-recovery",
    "repository": {
      "url": "https://github.com/leandroclf/fivem-server-monitor-pro.git",
      "base_ref": "main",
      "base_sha": "9de30c478c0f6f44645fbc830d16ed4d0ec18998"
    },
    "objective": "Concluir, documentar e revisar as correções preservadas após esgotamento de cota. Executar testes Lua determinísticos de retenção e recuperação do armazenamento, integrados ao CI, sem depender de cliente FiveM.",
    "scope": {
      "allowed_paths": [
        "server/storage.lua",
        "server/utils.lua",
        "tests/storage.test.lua",
        "package.json",
        ".github/workflows/ci.yml",
        "openspec/changes/server-monitor-production-readiness/tasks.md",
        "docs/CONFIGURATION.md"
      ]
    },
    "acceptance": {
      "criteria": [
        "Adicionar testes executáveis em lua5.4 sobre os módulos Lua reais, com stubs mínimos dos natives FXServer e do codec json, sem reimplementar o algoritmo sob teste em JavaScript.",
        "Exercitar limites de samples/events com muitas inserções, ordem de retenção, load de histórico acima do limite, recuperação de backup com primary inválido, ambos inválidos e falha de SaveResourceFile preservando dirty e dados recuperáveis.",
        "Corrigir produção somente quando uma regressão demonstrar o defeito; preservar backup válido durante recuperação, sem apagar dados, remover validação ou enfraquecer persistência para passar.",
        "Expor npm run test:lua e executá-lo no CI depois que lua5.4 estiver instalado. A dependência já é instalada pelo workflow atual; não adicionar biblioteca Lua/Node. Preservar os 12 testes JavaScript e o validador.",
        "Atualizar somente as evidências determinísticas correspondentes no OpenSpec. Manter pendentes cliente interativo, ACE em runtime, frameworks QBCore/Qbox/ESX e execução prolongada real. Não alterar EULA, configuração comercial ou telemetria.",
        "A base desta nova tarefa é o candidato não aprovado 9de30c478c0f6f44645fbc830d16ed4d0ec18998. A validação e a revisão devem cobrir o diff de produto completo desde 658dbfb7140df5cb30e7a57384ab5fbb89d05255, incluindo as correções herdadas, e os novos checks no HEAD final. A falha anterior foi exclusivamente de cota do provedor; não é aprovação nem teste falho. Não reescrever correções já presentes sem defeito demonstrado.",
        "Adicionar a docs/CONFIGURATION.md uma nota curta sobre recuperação e falha de persistência já corrigidas e os comandos npm run verify / npm run test:lua. Distinguir os testes determinísticos das aceitações pendentes em FXServer real. Não reimplementar a correção herdada nem marcar compatibilidade de frameworks como aceita."
      ]
    },
    "risk": {
      "level": "low"
    },
    "evidence": {
      "required": [
        "tests"
      ]
    }
  },
  "portfolio": {
    "registry_fingerprint": "b476209eb1a2fcef3f7dd99a53393e9846ccb674bb1ba26c0337819c55a4d3d9",
    "product": "fivem-server-monitor-pro",
    "capabilities": [
      {
        "name": "engineering_delivery",
        "decision": "REUSE",
        "owner": "product-platform-engineering-team"
      },
      {
        "name": "fivem_monitoring",
        "decision": "REUSE",
        "owner": "fivem-server-monitor-pro"
      }
    ]
  },
  "rules_refs": {
    "kit": {
      "ref": "37184551a1440b26fc5f117334f3ba3298332779"
    },
    "harness": {
      "ref": "4040e76bbd0ff8b5933550121b07201010919bf5"
    },
    "profile": "backend"
  }
}
