{
  "schema_version": "1.0",
  "proposal": {
    "proposal_id": "portfolio-20261014-vehicle-tracking-build-evidence-quota-recovery",
    "repository": {
      "url": "https://github.com/leandroclf/vehicle-tracking.git",
      "base_ref": "main",
      "base_sha": "8aa17557562b7521674785bcc063528eb16d25ed"
    },
    "objective": "Concluir, documentar e revisar as correções preservadas após esgotamento de cota. Consolidar a correção determinística do lockfile já preparado pelo host, documentar sua reprodução e validar a instalação e aplicação sem deploy.",
    "scope": {
      "allowed_paths": [
        "README.md",
        "pnpm-lock.yaml"
      ]
    },
    "acceptance": {
      "criteria": [
        "Conferir o commit de preparo do host 49efac0e00b935ed89cbacea6e266255d3f7f3da e seu pai 43cd73e423c25e20ebe0c25c0dd094a199c87648. O lockfile foi regenerado pelo pnpm declarado, sem scripts, e não deve ser reescrito manualmente pelo agente.",
        "Comparar manifest/importer do lockfile para as seis dependências OTEL já declaradas; preservar todas as versões/specifiers do package.json, artefato harness-v0.2.0 e pnpm-workspace. Dependências antigas preservam versões, admitindo novas associações de peers resultantes de OTEL.",
        "Acrescentar ao README um procedimento curto e exato de instalação congelada e regeneração deliberada do lockfile, indicando que falha de instalação não se resolve removendo --frozen-lockfile. Não reescrever o restante do README.",
        "O host deve comprovar instalação congelada do candidato no build da imagem e executar checks offline de lockfile, conformance do produto, typecheck, testes e build no HEAD final. Não afirmar deploy ou migração. Registrar qualquer falha preexistente com evidência em vez de mascará-la.",
        "Não alterar versões, manifests, workflows de deploy, código de aplicação, secrets, migrações ou APIs; necessidade de corrigir comportamento fora deste escopo exige replanejamento. A revisão local exige os checks do host. A publicação de PR e seu CI são G5 externo posterior a REVIEWED, responsabilidade do coordenador; não são presumidos executados pelo agente. Main dispara migração e deploy e não será integrado automaticamente.",
        "A base desta nova tarefa é o candidato não aprovado 8aa17557562b7521674785bcc063528eb16d25ed. A validação e a revisão devem cobrir o diff de produto completo desde 43cd73e423c25e20ebe0c25c0dd094a199c87648, incluindo as correções herdadas, e os novos checks no HEAD final. A falha anterior foi exclusivamente de cota do provedor; não é aprovação nem teste falho. Não reescrever correções já presentes sem defeito demonstrado.",
        "Atualizar também as afirmações obsoletas do README que dizem que typecheck, Jest e build falham ou que erros de build são ignorados: os checks atuais passaram, next.config.js mantém os ignores em false. Registrar essa baseline local com limites, preservando as dependências externas e a ausência de aceitação de produção. Não afirmar deploy realizado."
      ]
    },
    "risk": {
      "level": "medium"
    },
    "evidence": {
      "required": [
        "tests",
        "build"
      ]
    }
  },
  "portfolio": {
    "registry_fingerprint": "b476209eb1a2fcef3f7dd99a53393e9846ccb674bb1ba26c0337819c55a4d3d9",
    "product": "vehicle-tracking",
    "capabilities": [
      {
        "name": "engineering_delivery",
        "decision": "REUSE",
        "owner": "product-platform-engineering-team"
      },
      {
        "name": "vehicle_tracking",
        "decision": "REUSE",
        "owner": "vehicle-tracking"
      },
      {
        "name": "product_events",
        "decision": "REUSE",
        "owner": "product-platform-kit"
      }
    ]
  },
  "rules_refs": {
    "kit": {
      "ref": "37184551a1440b26fc5f117334f3ba3298332779"
    },
    "harness": {
      "ref": "b3375495bd86b6ee01d8430419496cbc492fbb49"
    },
    "profile": "devops"
  }
}
